{
    "schemaVersion": 1,
    "catalogId": "test",
    "manifestSha256": "f55a92d339d06af97ca059cd89a95b66928edf2da9f6f69297bb5f831d9da7ac",
    "signatures": [
        {
            "algorithm": "ed25519",
            "keyId": "rgm-catalog-2026-01",
            "value": "Cwx0B23OsK6ExjQiEEN49KuvIxs1iR2dC197kQNQVX24_LLRw0E4g116EEfO7tjCCmZswbLlNYhmruc879GpCA"
        }
    ]
}
